Discussion on boosting tourism in Jammu & Kashmir | Self-Reliant India | 25.03.2021\#\99 views\#\Mar 25, 2021\#\dd india doordarshan live dd india live tv dd india online stream, watch dd india live, Jammu & Kashmir, Self-Reliant India, Srinagar’s tulip garden, Tulip Garden\#\In our special broadcast 'Self-Reliant India', we take a closer look at developments in diverse sectors to better understand and articulate the rise of India.  In today's episode of 'Self-Reliant India', we discuss about the boosting tourism in Jammu & Kashmir.
News on the Hour | PM Modi's historic trip to Bangladesh , Parliament passes the Delhi bill & more\#\126 views\#\Mar 25, 2021\#\dd india doordarshan live dd india live tv dd india online stream, watch dd india live, PM Modi's historic trip, Bangladesh, Parliament passes, the Delhi bill, Campaigning for first phase to end, New variant not causing spike, Vaccine supply for all\#\Watch 'News on the Hour', the comprehensive one-hour show where we keep you updated with all the aspects of news items.  Top headlines are: - Campaigning for first phase to end - New variant not causing spike  - Vaccine supply for all
Foreign Secretary Harsh Vardhan Shringla briefs media on PM Narendra Modi's visti to Bangladesh\#\96 views\#\Mar 24, 2021\#\dd india doordarshan live dd india live tv dd india online stream, watch dd india live\#\Foreign Secretary Harsh Vardhan Shringla briefs media on PM Narendra Modi's visti to Bangladesh
Parliament News || 24.03.2021\#\42 views\#\Mar 24, 2021\#\dd india doordarshan live dd india live tv dd india online stream, watch dd india live\#\Parliament News || 24.03.2021
News Night: PM Modi to make his first foreign trip since Covid pandemic to Bangladesh & other news\#\150 views\#\Mar 24, 2021\#\dd india doordarshan live dd india live tv dd india online stream, watch dd india live\#\News Night: PM  Modi to make his first foreign trip since Covid pandemic to Bangladesh & other top news and updates
Special Programme: Swarnim Vijay Varsh\#\311 views\#\Mar 24, 2021\#\dd india doordarshan live dd india live tv dd india online stream, watch dd india live\#\Special Programme: Swarnim Vijay Varsh
Special Programme: Covid and economic revival roadmap || 24.03.2021\#\243 views\#\Mar 24, 2021\#\dd india doordarshan live dd india live tv dd india online stream, watch dd india live\#\Special Programme: Covid and economic revival roadmap || 24.03.2021
DD-Dialogue: Tales of Valour 1971\#\183 views\#\Mar 24, 2021\#\dd india doordarshan live dd india live tv dd india online stream, watch dd india live\#\DD-Dialogue: Tales of Valour 1971
Sports Buzz:Chinki Yadav, Aishwary win gold in shooting world cup and other sports news\#\136 views\#\Mar 24, 2021\#\dd india doordarshan live dd india live tv dd india online stream, watch dd india live\#\Sports Buzz:Chinki Yadav, Aishwary win gold in shooting world cup and other sports news
World Today: Bangladesh gears up to welcome PM Modi and other global news\#\115 views\#\Mar 24, 2021\#\dd india doordarshan live dd india live tv dd india online stream, watch dd india live\#\World Today: Bangladesh gears up to welcome PM Modi and other global news
Mid Day Prime | PM Modi says Bengal farmers will get PM Kisan money & more updates\#\120 views\#\Mar 24, 2021\#\dd india doordarshan live dd india live tv dd india online stream, watch dd india live, PM Modi, PM Kisan money, 600 detainees released in Myanmar, India top the medal\#\Catch your daily dose of the latest news on 'Mid Day Prime' where we bring news from India and around the world.  Top headlines are: - BJP to release manifesto for Kerala - All above 45 years can get jabs form April 1st  - Over 600 detainees released in Myanmar  - India top the medal tally in shooting WC
Discussion on new guidelines to constrain Covid-19 spread by MHA | Self-Reliant India | 24.03.2021\#\124 views\#\Mar 24, 2021\#\dd india doordarshan live dd india live tv dd india online stream, watch dd india live, Covid-19, MHA new COVID-19 guidelines, Self-Reliant India, new guidelines to control Covid-19, COVID-19, Stay home Stay safe\#\In our special broadcast 'Self-Reliant India', we take a closer look at developments in diverse sectors to better understand and articulate the rise of India.  In today's episode of 'Self-Reliant India', we discuss about the new guidelines to control Covid-19 spread by MHA.
News on the Hour | BJP to release Kerala election manifesto, MHA releases COVID-19 guidelines & more\#\82 views\#\Mar 24, 2021\#\dd india doordarshan live dd india live tv dd india online stream, watch dd india live, Kerala election manifesto, COVID-19 guidelines, Obamacare anniversary, No shortage of vaccines, World Tuberculosis day\#\Watch 'News on the Hour', the comprehensive one-hour show where we keep you updated with all the aspects of news items.  Top headlines are: - Biden marks Obamacare anniversary  - BJP to release Kerala election manifesto  - MHA guidelines on COVID-19 - Govt: No shortage of vaccines  - World Tuberculosis day today
Breakfast News | US President Joe Biden marks Obamacare anniversary & more updates\#\88 views\#\Mar 24, 2021\#\dd india doordarshan live dd india live tv dd india online stream, watch dd india live, US President Joe Biden, Obamacare anniversary, UK COVID-19 lockdown, Netanyahu claims huge win, Israel poll, BJP to release Kerala election manifesto, COVID-19, World Tuberculosis Day\#\Watch 'Breakfast News' to get the latest updates in and around the world along with the latest happenings from the world of sports, business, web review, health tip and more.  Top Headlines: - Anniversary of UK COVID-19 lockdown  - Netanyahu claims huge win in Israel poll - BJP to release Kerala election manifesto  - MHA guidelines on COVID-19 - World Tuberculosis Day
Parliament News | 23.03.2021\#\81 views\#\Mar 23, 2021\#\dd india doordarshan live dd india live tv dd india online stream, watch dd india live\#\Parliament News | 23.03.2021
NEWS NIGHT | Israelis vote in 4th General Election in 2 years & other news and updates | 23.03.2021\#\144 views\#\Mar 23, 2021\#\dd india doordarshan live dd india live tv dd india online stream, watch dd india live\#\Watch our daily prime broadcast on the happenings of the day.
DD EXCLUSIVE | Interview with Dr. Gowher Rizvi, International Affairs Advisor to Bangladesh PM\#\155 views\#\Mar 23, 2021\#\dd india doordarshan live dd india live tv dd india online stream, watch dd india live\#\Spl. Correspondent in Dhaka, Rajesh Jha, speaks to Dr. Gowher Rizvi, International Affairs Advisor to the Bangladesh PM.
DD DIALOGUE - Women of Honour: Medical Crusaders | 23.03.2021\#\178 views\#\Mar 23, 2021\#\dd india doordarshan live dd india live tv dd india online stream, watch dd india live\#\DD DIALOGUE - Women of Honour: Medical Crusaders | 23.03.2021
100 Top News & Updates from India and across the world | EXPRESS NEWS | 23.03.2021\#\127 views\#\Mar 23, 2021\#\dd india doordarshan live dd india live tv dd india online stream, watch dd india live\#\100 Top News & Updates from India and across the world in a quick wrap.
WORLD TODAY | No end to political crisis in Myanmar & other news updates from across the globe\#\100 views\#\Mar 23, 2021\#\dd india doordarshan live dd india live tv dd india online stream, watch dd india live\#\TOP HEADLINES:  - U.S. Mass shooting: 10 dead  - Sydney faces worst flood in 60 years - No end to political crisis in Myanmar  - World battles Covid-19
SPORTS BUZZ | Former England striker Frank Worthington passes away & other sports updates\#\105 views\#\Mar 23, 2021\#\dd india doordarshan live dd india live tv dd india online stream, watch dd india live\#\HEADLINES: - Ind vs Eng 1st ODI: Kohli & Dhawan make steady progress - Former England striker Frank Worthington passes away  - Zlatan makes return to Sweden squad
Mid Day Prime | Meeting of Permanent Indus Commission, World's largest vaccination drive & more\#\150 views\#\Mar 23, 2021\#\dd india doordarshan live dd india live tv dd india online stream, watch dd india live, Permanent Indus Commission, World's largest vaccination drive, Campaigning heats up in poll-bound states, India - England first ODI\#\Catch your daily dose of the latest news on 'Mid Day Prime' where we bring news from India and around the world.  Top headlines are: - Campaigning heats up in poll-bound states  - SC orders full waiver of interest on interest  - India - England first ODI today
Discussion on indigenous design and manufacture in Defence sector | Self-Reliant India | 23.03.2021\#\161 views\#\Mar 23, 2021\#\dd india doordarshan live dd india live tv dd india online stream, watch dd india live, indigenous design, manufacture in Defence sector, Self-Reliant India, Defence sector of India\#\In our special broadcast 'Self-Reliant India', we take a closer look at developments in diverse sectors to better understand and articulate the rise of India.  In today's episode of 'Self-Reliant India', we discuss about the indigenous design and manufacture in Defence sector.
News on the Hour | 2nd dose of Covishield after 6-8 weeks now, Global covid cases surge & more\#\106 views\#\Mar 23, 2021\#\dd india doordarshan live dd india live tv dd india online stream, watch dd india live, Covishield, Global covid cases surge, Campaigning heats up, Assam, West Bengal, India - England first ODI today\#\Watch 'News on the Hour', the comprehensive one-hour show where we keep you updated with all the aspects of news items.  Top headlines are: - Global covid tally crosses 12 crore mark  - Campaigning heats up in poll bound states  - Gwalior: 13 died in road accident  - India - England first ODI today
Breakfast News | Campaigning heats up in poll bound states & more updates\#\57 views\#\Mar 23, 2021\#\dd india doordarshan live dd india live tv dd india online stream, watch dd india live\#\Watch 'Breakfast News' to get the latest updates in and around the world along with the latest happenings from the world of sports, business, web review, health tip and more.  Top Headlines: - 2nd Covishield shot after 6-8 weeks now  - Morth crosses another milestone  - Gandhi peace prizes for 2019 & 2020 annouced  - Meeting of permanent Indus commission - India - England first ODI today
Parliament News | 22.03.2021\#\70 views\#\Mar 22, 2021\#\dd india doordarshan live dd india live tv dd india online stream, watch dd india live\#\Parliament News | 22.03.2021
NEWS NIGHT | Gandhi Peace Prize for 2019 & 2020 announced & other news and updates | 22.03.2021\#\175 views\#\Mar 22, 2021\#\dd india doordarshan live dd india live tv dd india online stream, watch dd india live\#\Watch our daily prime broadcast on the happenings of the day.
67th National Film Awards announced\#\1,484 views\#\Mar 22, 2021\#\dd india doordarshan live dd india live tv dd india online stream, watch dd india live\#\67th National Film Awards announced; Manoj Bajpayee & Dhanush win Best Actor; Kangana Ranaut  Best Actress
Special Broadcast | India in UNSC - February 2021 Edition | 22.03.2021\#\183 views\#\Mar 22, 2021\#\dd india doordarshan live dd india live tv dd india online stream, watch dd india live\#\Special Broadcast | India in UNSC - February 2021 Edition | 22.03.2021
100 Top News & Updates from India and across the world | EXPRESS NEWS\#\117 views\#\Mar 22, 2021\#\dd india doordarshan live dd india live tv dd india online stream, watch dd india live\#\100 Top News & Updates from India and across the world in a quick wrap.
WORLD TODAY | Sydney faces worst flood in 60 years & Other News Updates from across the globe\#\117 views\#\Mar 22, 2021\#\dd india doordarshan live dd india live tv dd india online stream, watch dd india live\#\TOP HEADLINES: - Afghanistan's Foreign Minister in India - US Defense Secy pays surprise visit to Kabul - Sydney faces worst flood in 60 years - Protests in Myanmar continues unabated - World battles Covid-19
Announcement of 67th National Film Awards at National Media Centre, New Delhi\#\3,144 views\#\Mar 22, 2021\#\dd india doordarshan live dd india live tv dd india online stream, watch dd india live\#\- Award for the most film friendly state goes to Sikkim - The best book on cinema goes to 'A Gandhian Affair: India's Curious Portrayal of Love in Cinema' written by Sanjay Suri - National Film Award for the best Hindi film goes to Chhichore  - The award for the Best Actor (shared) goes to Manoj Bajpayee for Bhonsle (Hindi) and  Dhanush for Asuran (Tamil) - The award for the best actress goes to 'Kangana Ranaut' for Manikarnika-The Queen Of Jhansi (Hindi) & Panga (Hindi)
Mid Day Prime | PM Modi launches 'Catch the Rain' campaign & more updates | 22.03.2021\#\176 views\#\Mar 22, 2021\#\dd india doordarshan live dd india live tv dd india online stream, watch dd india live, Catch the Rain' campaign, several states hit by second wave, Afghan foreign minister, Australia suffers from severe flooding, COVID-19\#\Catch your daily dose of the latest news on 'Mid Day Prime' where we bring news from India and around the world.  Top Headlines are: - Shopian, J&K: 4 terrorists killed  - BJP demands dismissal of Maharashtra government  - COVID-19: several states hit by second wave  - Afghan foreign minister in New Delhi  - Australia suffers from severe flooding
PM Narendra Modi launches ‘Jal Shakti Abhiyan: Catch the Rain’ campaign on World Water Day\#\61 views\#\Mar 22, 2021\#\dd india doordarshan live dd india live tv dd india online stream, watch dd india live, Jal Shakti Abhiyan, Prime Minister Narendra Modi, Ken Betwa Link Project\#\Prime Minister Narendra Modi launched ‘Jal Shakti Abhiyan: Catch the Rain’ campaign on World Water Day. In the presence of the Prime Minister, the signing of historic Memorandum of Agreement between the Union Minister of Jal Shakti and the Chief Ministers of Madhya Pradesh and Uttar Pradesh to implement the Ken Betwa Link Project, the first project of the National Perspective Plan for interlinking of rivers, will also take place.  About ‘Jal Shakti Abhiyan: Catch the Rain’  The Campaign will be undertaken across the country, in both rural and urban areas, with the theme “catch the rain, where it falls, when it falls”. It will be implemented from 22nd March 2021 to 30th November, 2021 - the pre-monsoon and monsoon period in the country. It will be launched as a Jan Andolan to take water conservation at grass-root level through people’s participation. It is intended to nudge all stakeholders to create rainwater harvesting structures suitable to the climatic conditions and subsoil strata, to ensure proper storage of rainwater.  After the event, Gram Sabhas will be held in all Gram Panchayats of each district (except in the poll bound states) to discuss issues related to water and water conservation. Gram Sabhas will also take ‘Jal Shapath’ for water conservation.  About MoA for Ken Betwa Link Project  The agreement heralds the beginning of inter- state cooperation to implement the vision of Former Prime Minister Atal Bihari Vajpayee to carry water from areas that have surplus water to drought prone and water deficit areas, through the interlinking of rivers. This project involves transfer of water from the Ken to the Betwa River through the construction of Daudhan Dam and a canal linking the two rivers, the Lower Orr Project, Kotha Barrage and Bina Complex Multipurpose Project. It will provide annual irrigation of 10.62 lakh ha, drinking water supply to about 62 lakh people and also generate 103 MW of hydropower.  The Project will be of immense benefit to the water starved region of Bundelkhand, especially to the districts of Panna, Tikamgarh, Chhatarpur, Sagar, Damoh, Datia, Vidisha, Shivpuri and Raisen of Madhya Pradesh and Banda, Mahoba, Jhansi and Lalitpur of Uttar Pradesh. It will pave the way for more interlinking of river projects to ensure that scarcity of water does not become an inhibitor for development in the country.
News on the Hour | PM Modi to launch 'Catch the Rain' movement on World Water Day & more updates.\#\124 views\#\Mar 22, 2021\#\dd india doordarshan live dd india live tv dd india online stream, watch dd india live\#\Watch 'News on the Hour', the comprehensive one-hour show where we keep you updated with all the aspects of news items.  Top headlines are:  - Shopian, J&K: 4 terrosists killed  - Heavy campaigning for Assembly polls  - Key bills on agenda in Parliament
Breakfast News | PM Modi to launch "Catch the Rain" movement & more updates\#\116 views\#\Mar 22, 2021\#\dd india doordarshan live dd india live tv dd india online stream, watch dd india live, Catch the Rain, Water Day, Assembly polls, Key bills on agenda in Parliament today, Maharashtra, Kabul, US defence secretary, severe flooding, Australia\#\Watch 'Breakfast News' to get the latest updates in and around the world along with the latest happenings from the world of sports, business, web review, health tip and more.   Top headline of the day:  - Heavy campaigning for Assembly polls  - Key bills on agenda in Parliament today  - Maharashtra reports single day highest cases  - US defence secretary surprise visit to Kabul  - Australia suffers from severe flooding
NEWS NIGHT | World braces as Covid surges & Other news and updates | 21.03.2021\#\127 views\#\Mar 21, 2021\#\dd india doordarshan live dd india live tv dd india online stream, watch dd india live\#\Watch our daily prime broadcast on the happenings of the day.
IN FOCUS | Forest Restoration: Path to Water conservation\#\80 views\#\Mar 21, 2021\#\dd india doordarshan live dd india live tv dd india online stream, watch dd india live\#\IN FOCUS | Forest Restoration: Path to Water conservation | 21.03.2021
IN FOCUS | Indo-Pacific and the new Global order\#\168 views\#\Mar 21, 2021\#\dd india doordarshan live dd india live tv dd india online stream, watch dd india live\#\Guests: Prof. Sachin Chaturvedi, Director General at the Research and Information System for Developing Countries (RIS) & Sushant Sareen, Senior Fellow at Observer Research Foundation
Special Broadcast | Aspirational India | 21.03.2021\#\149 views\#\Mar 21, 2021\#\dd india doordarshan live dd india live tv dd india online stream, watch dd india live\#\Aspirational India - brings stories of everyday people and their extraordinary endeavours that have led to great transformation
NEWS CONNECT | Heavy rain lashes Australia's East Coast & Other News and Updates\#\153 views\#\Mar 21, 2021\#\dd india doordarshan live dd india live tv dd india online stream, watch dd india live\#\TOP HEADLINES - Campaign gains momentum - PM to launch Jal Shakti: Catch Rain Campaign - Today is World Forestry Day - India crosses 4.4 crore Covid19 vaccination - Heavy rain lashes Australia's East Coast - India win Men,Women 10 m Air Pistol Team Gold
The News | PM Modi to launch Jal Shakti campaign, Election rallies in poll-bound states & more\#\197 views\#\Mar 21, 2021\#\dd india doordarshan live dd india live tv dd india online stream, watch dd india live, President Ram Nath Kovind, Election rallies in poll-bound states, COVID-19 vaccincation, Australia's east coast, T20 match against England\#\Top Headlines:  - President Ram Nath Kovind addresses NIT Rourkela convocation - India crosses 4.4 crore COVID-19 vaccincation - Heavy rain lashes Australia's east coast  - India wins decider T20 match against England
News on the Hour | PM Modi to address election rallies in Assam and West Bengal & more updates.\#\77 views\#\Mar 21, 2021\#\dd india doordarshan live dd india live tv dd india online stream, watch dd india live\#\Watch 'News on the Hour', the comprehensive one-hour show where we keep you updated with all the aspects of news items.  Top headlines are:  - Parambir alleges corruption - Madya Pradesh: Sunday lockdown in 3 cities  - India thump England to seal series 3-2
The News | Campaign gains momentum in poll bound states, India-US defence ties & more updates\#\58 views\#\Mar 21, 2021\#\dd india doordarshan live dd india live tv dd india online stream, watch dd india live, poll bound states, Assam and West Bengal election, COVID-19 vaccination, India-US defence ties, Rajanth Singh, Lloyd Austin, - PM Modi to hold election rallies, COVID-19\#\Top Headlines are - PM Modi to hold election rallies in Assam and West Bengal - COVID-19 vaccination cross 4.36 crore mark  - Indian wins decider T20 match against England
Startup Champions focussing on ‘startups’ providing Urban Services\#\490 views\#\Mar 21, 2021\#\dd india doordarshan live dd india live tv dd india online stream, watch dd india live\#\Startup Champions focussing on ‘startups’ providing Urban Services
News Night: India-US agree to strengthen defence ties and other top news & updates\#\179 views\#\Mar 20, 2021\#\dd india doordarshan live dd india live tv dd india online stream, watch dd india live\#\India-US agree to strengthen defence ties  --- Defense Minister Rajnath Singh holds delegation level talks with US Defense Secretary Lloyd Austin; Both countries agree to work together to support a broader global strategic partnership; India and US committed to strengthening defense partnership in shifting International dynamics  PM campaigns in W. Bengal and Assam  --- Prime Minister Narendra Modi addresses election rallies in West Bengal and Assam; In Kharagpur PM targets 10 years of alleged corruption and misrule of Mamta government; In Chabua PM says the NDA is committed to development for Assam   Campaign gains momentum  --- Major Political parties campaign in strength in battleground states; Congress-led UDF in Kerala releases election manifesto, In Assam too Congress releases manifesto making several populist promises; Mamata Banerjee addresses public meetings in West Bengal  Corona vaccinations cross 4.2 crore  --- India crosses 4.2 crore Corona Vaccinations; more than 27 lakh vaccinations given within a day; Daily new Covid case count on the rise in Maharashtra, Punjab, Karnataka, Gujarat and Madhya Pradesh   Dattatreya Hosabale RSS Sarkaryavah  --- Dattatreya Hosabale elected General Secreatary or Sar-karya-vah of Rashtriya Swayamsevak Sangh; Takes over from Suresh Bhaiyaji Joshi after two-day annual Akhil Bharatiya Pratinidhi Sabha in Bengaluru   Parambir Singh  startling charge  --- Former Mumbai Police Commissioner Parambir Singh writes to Maharashtra Chief Minister Uddhav Thackeray; Makes startling allegation that State Home Minister Anil Deshmukh gave Sachin Waze a target of Rs 100 crore to collect every month from bars and other estbalishments; Deshmukh says charges are fabricated......BJP leaders in Mumbai and Delhi lash out at the state govt on corruption charges  Foreign fans banned from Tokyo Olympics  --- Japan bans foreign fans from attending Tokyo Olympic games due to rising Covid cases; Event was postponed last year due to Covid  And  P.V Sindhu loses in Semi-Finals  --- PV Sindhu loses in the Women's singles semi final of the All England Bandminton Championship; She loses to Thailand's Chochuwong 21-17, 21-9
Media Scan with special discussion on the issue of identity politics Vs development politics?\#\47 views\#\Mar 20, 2021\#\dd india doordarshan live dd india live tv dd india online stream, watch dd india live\#\Media Scan with special discussion on the issue of identity politics Vs development politics?  Week's top headlines  -PM Modi cautions on COVID surge -Mumbai Police Commissioner Param Bir Singh shunted out -Khela Vs Vikash in West Bengal -DFI to boost infra
Sports 360°: Champions league quarterfinal draw and other news from world of sports\#\122 views\#\Mar 20, 2021\#\dd india doordarshan live dd india live tv dd india online stream, watch dd india live\#\Sports 360°:  Champions league quarterfinal draw and other news from world of sports
News Connect: US Defense Secretary Lloyd Austin’s India visit and other top news\#\250 views\#\Mar 20, 2021\#\dd india doordarshan live dd india live tv dd india online stream, watch dd india live\#\News Connect: US Defense Secretary Lloyd Austin’s India visit and other top news
The News: India-US ties stronghold of India-Pacific & other news | 20.03.2021\#\86 views\#\Mar 20, 2021\#\dd india doordarshan live dd india live tv dd india online stream, watch dd india live, India-US ties stronghold of India-Pacific
India vs England: Decisive T20 today\#\Here are the top headlines of the day-  1.US Defence Secretary is on India visit 2. India-US ties stronghold of India-Pacific 3. India vs England: Decisive T20 today
Self-Reliant India: Discussion on India-US Defence ties | 20.03.2021\#\100 views\#\Mar 20, 2021\#\dd india doordarshan live dd india live tv dd india online stream, watch dd india live, aatmanirbhar bharat, India-US ties stronghold of India-Pacific, India vs England: Decisive T20 today\#\Watch Aatmanirbhar Bharat, our special broadcast on the latest initiatives of the government towards an empowered India.  Topic: Discussion on India-US Defence ties
Defence Minister Rajnath Singh & US Secretary of Defence Lloyd J. Austin III issue joint statement\#\3,710 views\#\Mar 20, 2021\#\dd india doordarshan live dd india live tv dd india online stream, watch dd india live\#\Defence Minister Rajnath Singh & US Secretary of Defence Lloyd J. Austin III issue joint statement
US Secretary of Defence inspects Tri-Services’ Guard of Honour at Vigyan Bhawan & more | 20.03.2021\#\174 views\#\Mar 20, 2021\#\dd india doordarshan live dd india live tv dd india online stream, watch dd india live\#\Top Headlines:  -US Secretary of Defense  Lloyd J Austin  III lays a wreath and pays homage to the fallen heroes at #NationalWarMemorial, New Delhi, today.  -US-China talk wrap up after bitter opening exchanges; US Secretary of State Antony Blinken said, Beijing gave a defensive response  -Amrut Mahotsav: On the occasion of the 75th anniversary of India's independence and to honor the freedom fighters ITBP holds run on Friday  -India's total active caseload stands at 2.88 lakh; the recovery rate touches 96.26%
