News Night: Four day Vaccination festival or Tika Utsav underway across the nation & other top news\#\151 views\#\Apr 11, 2021\#\dd india doordarshan live dd india live tv dd india online stream, watch dd india live\#\TIKA UTSAV: 2ND WAR AGAINST CORONA  Four day Vaccination festival or Tika Utsav underway across the nation from Sunday ... Prime Minister Narendra Modi says 'Tika Utsav' is beginning of second major war against Corona ...Asks to make targets at personal, social and at the administration level for 'Tika Utsav' and diligently make efforts to achieve them  EXPORT OF REMDESIVIR BANNED  Fight Against Covid19 intensifies... Export Of Anti-Viral Drug Remdesivir banned Amid Surge in cases... India to have 5 more COVID vaccines by October, Sputnik expected to get emergency use nod in 10 days.  CENTRE WRITES TO 3 STATES OVER COVID PLAN  Union Health Secretary writes letters to three states Chhattisgatrh, Punjab amd Maharashtra amid surging covid cases, asks states to enforce plan properly in containment zones... directs Maharashtra to follow covid protocol amidst reports of over crowding of hospitals in the states.    WEST BENGAL 5TH PHASE CAMPAIGNING IN FULL SWING  Campaigning on in full swing for the fifth phase assembly election in West Bengal... Amit Shah holds a roadshow in Nadia district's Santipur ...TMC and other parties enagage in hectic campaigning...Election Commission orders campaigning to close 72 hours prior to the end of polling in the fifth phase.  J&K: 5 TERRORISTS ELIMINATED  Major success for Security Forces in Jammu and Kashmir, Five terrorists eliminated in Anantnag and Shopian districts ... Search operation going on.     BIRTH ANNIVERSARY OF JYOTIRAO PHULE  Birth anniversary of great social reformer Jyotirao Phule observed across the country, Prime Minister Narendra Modi says Phule remained committed to the education and empowerment of women throughout his life.  AND  2ND ROYAL BATH OF MAHA KUMBH  Haridwar is all set for the second royal bath of Maha Kumbh on Monday under the COVID-19 protocols. Processions of the 13 Akhadas to be carried through highways...no vehicular movement to be allowed in the route.
Aspirational India: Stories of inspiring men and women from across the India\#\161 views\#\Apr 11, 2021\#\dd india doordarshan live dd india live tv dd india online stream, watch dd india live\#\Aspirational India: Stories of inspiring men and women from across the India who inspire, enourage and motivate
News Connect: Four day vaccination festival 'Teeka Utsav' underway across country and other top news\#\113 views\#\Apr 11, 2021\#\dd india doordarshan live dd india live tv dd india online stream, watch dd india live\#\News Connect: Four day vaccination festival 'Teeka Utsav' underway across the country and other top news
The News | India's 'Tika Utsav' gets huge support across the country & more updates | 11.04.2021\#\163 views\#\Apr 11, 2021\#\dd india doordarshan live dd india live tv dd india online stream, watch dd india live, Tika Utsav', West Bengal: 76% turnout in phase 4, J&K 5 terrorist eliminated, Birth anniversary of Jyotirao Phule, Centre to provide 1, 121 ventilators\#\Watch "The News" to catch on all the latest news updates from India and around the globe.  Top Headlines are:  - West Bengal: 76% turnout in phase 4  - J&K 5 terrorist eliminated  - Birth anniversary of Jyotirao Phule  - Centre to provide 1,121 ventilators
News on the Hour | India observes four day vaccination festival from today & more updates\#\170 views\#\Apr 11, 2021\#\dd india doordarshan live dd india live tv dd india online stream, watch dd india live\#\Watch 'News on the Hour', the comprehensive one-hour show where we keep you updated with all the aspects of news items.  Top headlines are: -  West Bengal : 76% turnout in phase 4  - EC's strict stand on Cooch Behar voilence  - Centre to provide 1,121 ventilators  - Narendra Singh Tomar: Ready to talk with farmers
The News | Four days vaccination festival to begin from today & more updates | 11.04.2021\#\95 views\#\Apr 11, 2021\#\dd india doordarshan live dd india live tv dd india online stream, watch dd india live, Vaccination festival to begin from today, West Bengal : 76% turnout, Centre to provide 1, 121 ventilators, COVID-19, Farm laws\#\Watch "The News" to catch on all the latest news updates from India and around the globe.  Top Headlines are:  - West Bengal : 76% turnout in phase 4  - Centre to provide 1,121 ventilators  - Narendra Singh Tomar: Ready to talk with farmers
News Night: Violence mars fourth phase of polling in West Bengal & other top news\#\189 views\#\Apr 10, 2021\#\dd india doordarshan live dd india live tv dd india online stream, watch dd india live\#\Violence in Fourth Phase of Polling  - Violence mars fourth phase of polling in West Bengal; clashes in Cooch Behar's Sitalkuchi polling booth result in four people being killed; Election Commission suspends polling at that polling station; Both BJP and TMC delegations meet Election Commission and demand free and fair election.  Huge turnout in 44 seats  --- More than 76 percent polling reported for 44 seats in five districts of West Bengal;  Enthusiastic voters exercise their franchise in the festival of democracy; visible enthusiasm among young women voters; Voting takes place following all Covid protocols  PM targets Mamata Banerjee at poll rallies  --- PM Modi campaigns for the 5th phase of polling in West Bengal; Expresses grief at the loss of lives in Cooch Behar violence; Says Mamata Banerjee's anger is increasing in the face of her imminent defeat  Prashant Kishor's leaked audio  -- Leaked audio of TMC election strategist Prashant Kishor causes a major stir;  BJP IT cell head Amit Malviya releases audio in which Kishor says PM Modi is extremely popular in the state; BJP claims TMC has accepted defeat;  Prashant Kishore asks for release of the entire audio recording  11th Corps Commander level talks  --- At Friday's 11th Corps Commander level talks between India and China... both countries discuss withdrawal of troops from the rest of the LAC in eastern Ladakh; Talks last 13 hours and discuss friction areas like Hot Springs, Gogra, and the 900 sq-km Depsang plains  Tomar: Ready to talk to farmers  --- Central Government once again says it is ready for talks with the agitating farmers; Union Agriculture Minister Narendra Singh Tomar says farmers should withdraw the agitation in the wake of  increasing Covid cases   India sets record in vaccinations  --- India's war against Covid intensifies; India crosses  100 million vaccine doses in 85 days, the world's fastest  India condemns violence in Myanmar  -- India said the time has come for greater engagement with Myanmar and not less; Lack of engagement will only create a vacuum which will be counterproductive; Welcomes ASEAN efforts; Says UN should play its role
Media Scan: TMC targets EC, forces; EC pulls up Mamata Banerjee for comment on forces\#\137 views\#\Apr 10, 2021\#\dd india doordarshan live dd india live tv dd india online stream, watch dd india live\#\Media Scan: TMC targets EC, forces; EC pulls up Mamata Banerjee for comment on forces
Sports 360°: Four Indian sailors qualify for Olympics and more news & updates from world of sports\#\78 views\#\Apr 10, 2021\#\dd india doordarshan live dd india live tv dd india online stream, watch dd india live\#\Sports 360°: Four Indian sailors qualify for Olympics and more news & updates from world of sports
News Connect: West Bengal votes for 4th phase assembly elections and other top news\#\184 views\#\Apr 10, 2021\#\dd india doordarshan live dd india live tv dd india online stream, watch dd india live\#\News Connect: West Bengal votes for 4th phase assembly elections and other top news
Shocking imbalance in the distribution of COVID-19 vaccines worldwide: WHO | The News | 10.04.2021\#\120 views\#\Apr 10, 2021\#\dd india doordarshan live dd india live tv dd india online stream, watch dd india live\#\Top Headlines:  -West Bengal: Voting underway for phase four of assembly elections  -COVID-19: The fatality rate in the country stands at 1.28%  -Mumbai police issues fresh set of guidelines on lockdown, night curfew  -Rajasthan: Night curfew imposed in Jaipur, Jodhpur, and six other countries till April 30  -India condemns the use of violence in Myanmar  -Shocking imbalance in the distribution of COVID-19 vaccines worldwide: WHO      -
Self-Reliant India: CSIR adopts 295 Atal Tinkering Labs across India | 10.04.2021\#\77 views\#\Apr 10, 2021\#\dd india doordarshan live dd india live tv dd india online stream, watch dd india live\#\In our special broadcast 'Self-Reliant India', we take a closer look at developments in diverse sectors to better understand and articulate the rise of India.
India Ideas: The Ventilator Project | 8.04.2021\#\176 views\#\Apr 10, 2021\#\dd india doordarshan live dd india live tv dd india online stream, watch dd india live\#\India Ideas looks at a tale of triumph against heavy odds in making indigenous ICU ventilator. DD India team speaks to members of the team behind manufacturing ICU ventilator during the lockdown in 90 days.   The 'Ventilator Project' chronicles the story of the development and manufacturing of Noccarc V310.
Third wave of COVID-19 grips France & more | News on the Hour | 10.04.2021\#\157 views\#\Apr 10, 2021\#\dd india doordarshan live dd india live tv dd india online stream, watch dd india live\#\Top Headlines:  -West Bengal: Voting underway for phase four of assembly elections  -Senior BJP leader and PM Narendra Modi to address rallies at Siliguri and Krishnanagar  -Mumbai police issues fresh set of guidelines on lockdown and night curfew  -US president Joe Biden unveils $1.5 trillion budget proposal; The massive proposal which focuses on Health, education, and climate is a precursor to its official FY2022 budget proposal  -Ousted Myanmar lawmakers urged the United Nations Security Council to take action against the military over a 1st February coup as an independent think tank warned the 15 council members that the Asian state was on the brink of collapse
Global Scan: Another mass shooting in USA and other major global developments of the week\#\154 views\#\Apr 9, 2021\#\dd india doordarshan live dd india live tv dd india online stream, watch dd india live\#\Global Scan: Another mass shooting in USA and other major global developments of the week
News Night: 24th GoMs meet on COVID 19 reviews situation across country & other top news\#\113 views\#\Apr 9, 2021\#\dd india doordarshan live dd india live tv dd india online stream, watch dd india live\#\TACKLING COVID-19: 24TH GOM MEET  24th Group of Ministers meet on COVID 19 reviews situation across the country...Union Health Minister says 11 States contribute to 54% of total cases & 65% of total deaths..Disproportionately higher deaths in Maharashtra and Punjab have spiked over the last fortnight....Ministers apprised of actions taken to increase Production Capacity of Existing Vaccines, and Potency & Timeline of those undergoing Clinical Trials..  TOTAL VACCINATION EXCEEDS 9.43 CR --- Fight against COVID-19 continues....total Vaccination Coverage exceeds 9.43 Crores with over 36 Lakh doses given in the last 24 hours...UP Chief Minister announces Vaccination festival from 11th April...Delhi govt closes schools and colleges till further notice...Complete lockdown begins in Raipur, weekend lockdown in Bhopal, Mumbai...  COMPLETE LOCKDOWN IN B'DESH FROM 14 APRIL ---Bangladesh announces complete lockdown from 14th April...German health Minister also bats for a complete lockdown to break the COVID-19 Chain....Japanese government places state of "quasi-emergency" in Tokoyo to combat a spike in COVID-19 cases ahead of the Olympics...  INDIA-NETHERLANDS VIRTUAL SUMMIT  ---In a virtual summit between India and Netherlands, PM Modi stressed both nations share  same concern   on global issues like climate change , terrorism , and Covid 19 Pandemic . PM emphasised on boosting  strategic patnership  in water management between india and Netherlands .  J&K: 7 TERRORISTS GUNNED DOWN  -- Big breakthrough for security forces in Kashmir valley....In a single day 7 dreaded terrorists gunned down by forces in terror hotbeds of Pulwama and shopian....Kashmir Zone Police confirms, Ansar Ghazwat-ul-Hind chief,  among dead terriorist....  SC: PROTESTS SHOULD NOT DISTRUPT TRAFFIC  -- Supreme court observes- protest demonstrations should not distrupt traffic....Hearing a petition , Court observes demonstrations should not disturb public life... PRINCE PHILIP PASSES AWAY ---Prince Philip, Husband Of Queen Elizabeth II, dies At 99...Royal family makes the announcement...PM Narendra Modi Condoles the passing away of Duke of Edinburgh...says he had a distinguished career in the military and was at the forefront of many community service initiatives. TOKYO OLYMPICS: FOUR INDIAN SAILORS QUALIFY ---Army Subedar Vishnu Saravanan qualifies for Tokyo Olympics winning Asian Olympic sailing championships...Four Indian sailors will compete at the Olympics...
Virtual Encounters: India's hockey legend Zafar Iqbal\#\45 views\#\Apr 9, 2021\#\dd india doordarshan live dd india live tv dd india online stream, watch dd india live\#\Virtual Encounters: India's hockey legend Zafar Iqbal
News Express: India-Netherlands virtual summit and other news in fast mode\#\118 views\#\Apr 9, 2021\#\dd india doordarshan live dd india live tv dd india online stream, watch dd india live\#\News Express: India-Netherlands virtual summit and other news in fast mode
World Today: Another mass shooting rocks USA and other top global news\#\171 views\#\Apr 9, 2021\#\dd india doordarshan live dd india live tv dd india online stream, watch dd india live\#\World Today: Another mass shooting rocks USA and other top global news
The News: India, Netherlands hold virtual summit and other top news\#\79 views\#\Apr 9, 2021\#\dd india doordarshan live dd india live tv dd india online stream, watch dd india live\#\The News: India, Netherlands hold virtual summit and other top news
PM Modi holds Virtual Summit with his Netherlands counterpart Mark Rutte\#\137 views\#\Apr 9, 2021\#\dd india doordarshan live dd india live tv dd india online stream, watch dd india live\#\PM Modi holds Virtual Summit with his Netherlands counterpart Mark Rutte
Mid Day Prime | 7 terrorists killed in J&K, GOM on COVID-19 & more updates | 09.04.2021\#\150 views\#\Apr 9, 2021\#\dd india doordarshan live dd india live tv dd india online stream, watch dd india live\#\Catch your daily dose of the latest news on 'Mid Day Prime' where we bring news from India and around the world.  Top headlines are: - Night curfew in several cities  - India-Netherlands summit  - 11th round of border talks at Chushul
Kasavu: Traditional handloom from Kerala\#\116 views\#\Apr 9, 2021\#\dd india doordarshan live dd india live tv dd india online stream, watch dd india live\#\Kasaua: Traditional handloom from Kerala
News on the Hour | Centre says no shortage of COVID-19 vaccines & more updates\#\140 views\#\Apr 9, 2021\#\dd india doordarshan live dd india live tv dd india online stream, watch dd india live\#\Watch 'News on the Hour', the comprehensive one-hour show where we keep you updated with all the aspects of news items.  Top headlines are: - MEA: NO ban on vaccine export  - India-Netherland virtual summit  - India-China 11th round border talks  - Kazakh defence minister in India
Breakfast News | PM Modi discusses COVID-19 situation with states & more updates\#\201 views\#\Apr 9, 2021\#\dd india doordarshan live dd india live tv dd india online stream, watch dd india live\#\Watch 'Breakfast News' to get the latest updates in and around the world along with the latest happenings from the world of sports, business, web review, health tips and more.  Top Headlines: - Centre: No shortage of vaccines  - MEA: No ban on Vaccine export  - India-Netherlands virtual summit today  - Kazakh-Defence Minister in India
PM chairs high level meeting of committee to commemorate 400th Birth Anniversary of Guru Teg Bahadur\#\208 views\#\Apr 8, 2021\#\dd india doordarshan live dd india live tv dd india online stream, watch dd india live\#\PM Modi chairs high level meeting of committee to commemorate 400th Birth Anniversary of Sri Guru Teg Bahadur Ji
NEWS NIGHT | India backs Seychelles development & other news and updates | 08.04.2021\#\134 views\#\Apr 8, 2021\#\dd india doordarshan live dd india live tv dd india online stream, watch dd india live\#\Watch our daily prime time broadcast on the happenings of the day.
Farm Reforms: A Positive view from outside | Interview with Columnist Salvatore Babones\#\137 views\#\Apr 8, 2021\#\dd india doordarshan live dd india live tv dd india online stream, watch dd india live\#\Special Broadcast | Farm Reforms: A Positive view from outside | Interview with Salvatore Babones, Columnist, Foreign Policy
PM Narendra Modi chairs virtual meeting with CMs of all states on COVID19 situation\#\2,432 views\#\Apr 8, 2021\#\dd india doordarshan live dd india live tv dd india online stream, watch dd india live\#\PM Narendra Modi chairs virtual meeting with CMs of all states on COVID19 situation | 08.04.2021
100 Top News & Updates from India and across the world | EXPRESS NEWS | 08.04.2021\#\80 views\#\Apr 8, 2021\#\dd india doordarshan live dd india live tv dd india online stream, watch dd india live\#\100 Top News & Updates from India and across the world in a quick wrap.
WORLD TODAY | PM Modi holds high-level virtual event with Seychelles President & much more | 08.04.2\#\108 views\#\Apr 8, 2021\#\dd india doordarshan live dd india live tv dd india online stream, watch dd india live\#\WORLD TODAY | PM Modi holds high-level virtual event with Seychelles President & much more | 08.04.2021
Ministry of External Affairs (MEA) Press Briefing | 08.04.2021\#\123 views\#\Apr 8, 2021\#\dd india doordarshan live dd india live tv dd india online stream, watch dd india live\#\Ministry of External Affairs (MEA) Press Briefing | 08.04.2021
India-Seychelles High-Level Virtual Event | 08.04.2021\#\75 views\#\Apr 8, 2021\#\dd india doordarshan live dd india live tv dd india online stream, watch dd india live\#\India-Seychelles High-Level Virtual Event | 08.04.2021
THE NEWS | India-Seychelles High-Level Virtual Event & much more | 08.04.2021\#\121 views\#\Apr 8, 2021\#\dd india doordarshan live dd india live tv dd india online stream, watch dd india live\#\THE NEWS | India-Seychelles High-Level Virtual Event & much more | 08.04.2021
Mid Day Prime | PM Modi chairs high-level meeting on Prakash Purab & more updates | 08.04.2021\#\162 views\#\Apr 8, 2021\#\dd india doordarshan live dd india live tv dd india online stream, watch dd india live, PM takes second shot of COVID vaccine, PM to review COVID situation, 9 crore COVID-19 vaccine doses, PM chairs high-level meeting on Prakash Purab, US: prepared to hold talks with Iran\#\Catch your daily dose of the latest news on 'Mid Day Prime' where we bring news from India and around the world.  Top headlines are: - 9 crore COVID-19 vaccine doses in 82 days  - PM chairs high-level meeting on COVID situation  - US: prepared to hold talks with Iran
Discussion on the achievements of Pradhan Mantri MUDRA scheme | Self-Reliant India | 08.04.2021\#\105 views\#\Apr 8, 2021\#\dd india doordarshan live dd india live tv dd india online stream, watch dd india live, Pradhan Mantri MUDRA Yojana, Self-Reliant India\#\In our special broadcast 'Self-Reliant India', we take a closer look at developments in diverse sectors to better understand and articulate the rise of India.  In today's episode of 'Self-Reliant India', we discuss the achievements of Pradhan Mantri MUDRA Yojana and what is the road ahead.
News on the Hour | PM Modi to hold meeting on COVID-19 with CMs of all states today & more updates\#\227 views\#\Apr 8, 2021\#\dd india doordarshan live dd india live tv dd india online stream, watch dd india live, PM Modi to hold meeting on COVID-19, Vaccinations at workplace, PM Modi to inaugurate projects for Seychelles, foreign minister of Bahrain, US: prepared to lift sanctions on Iran\#\Watch 'News on the Hour', the comprehensive one-hour show where we keep you updated with all the aspects of news items.  Top headlines are: - Vaccinations at workplace from 11 April - PM Modi to inaugurate projects for Seychelles  - EAM meets foreign minister of Bahrain  - US: prepared to lift sanctions on Iran
Breakfast News | PM Modi takes second dose of COVID vaccine & more updates.\#\212 views\#\Apr 8, 2021\#\dd india doordarshan live dd india live tv dd india online stream, watch dd india live, PM Modi takes second dose of COVID vaccine, foreign minister of Bahrain, US: prepared to lift sanctions on Iran\#\Watch 'Breakfast News' to get the latest updates in and around the world along with the latest happenings from the world of sports, business, web review, health tips and more.  Top Headlines: - PM Modi to inaugurate projects for Seychelles  - EAM meets foreign minister of Bahrain  - US: prepared to lift sanctions on Iran
News Night: PM Modi interacts with students, parents & teachers in a virtual #ParikshaPeCharcha 2021\#\235 views\#\Apr 7, 2021\#\dd india doordarshan live dd india live tv dd india online stream, watch dd india live\#\Watch our Special coverage LIVE on DD India
Pariksha Pe Charcha : PM Narendra Modi's interaction with Exam Warriors.\#\1,505 views\#\Apr 7, 2021\#\dd india doordarshan live dd india live tv dd india online stream, watch dd india live\#\Watch our Special coverage LIVE on DD India
"How should we remember this period of Corona pandemic?" - Dharvi from Gujarat\#\76 views\#\Apr 7, 2021\#\dd india doordarshan live dd india live tv dd india online stream, watch dd india live\#\Watch our Special coverage LIVE on DD India
"Is failure in exam failure in life too?" - Shreyaan from West Bengal\#\46 views\#\Apr 7, 2021\#\dd india doordarshan live dd india live tv dd india online stream, watch dd india live\#\Watch our Special coverage LIVE on DD India
How can we lessen the generation gap between parents and children? - Krishty Saikia\#\94 views\#\Apr 7, 2021\#\dd india doordarshan live dd india live tv dd india online stream, watch dd india live\#\Watch our Special coverage LIVE on DD India
PM Modi gives formula to sharpen memory in PPC2021 - "Involve, Internalize, Associate & Visualise\#\56 views\#\Apr 7, 2021\#\dd india doordarshan live dd india live tv dd india online stream, watch dd india live\#\Watch our Special coverage LIVE on DD India
Divyanka from Rajasthan seeks PM Narendra Modi's advice on memory recollection\#\158 views\#\Apr 7, 2021\#\dd india doordarshan live dd india live tv dd india online stream, watch dd india live\#\Watch our Special coverage LIVE on DD India
Amrita from Uttar Pradesh and Sunita from Chhattisgarh wants to ask on food habits of children\#\43 views\#\Apr 7, 2021\#\dd india doordarshan live dd india live tv dd india online stream, watch dd india live\#\Watch our Special coverage LIVE on DD India
How to prepare ourselves for the battle of life? - Tanay from Kuwait and Ashraf from Uttarakhand\#\13 views\#\Apr 7, 2021\#\dd india doordarshan live dd india live tv dd india online stream, watch dd india live\#\Watch our Special coverage LIVE on DD India
How can the children be self-motivated so that they do their tasks on their own?\#\44 views\#\Apr 7, 2021\#\dd india doordarshan live dd india live tv dd india online stream, watch dd india live\#\Watch our Special coverage LIVE on DD India
An interesting question from Aashay ji from Bengaluru and Praveen ji from Bihar on values\#\20 views\#\Apr 7, 2021\#\dd india doordarshan live dd india live tv dd india online stream, watch dd india live\#\Watch our Special coverage LIVE on DD India
Neel from Kanyakumari wants the Prime Minister's guidance on free time.\#\35 views\#\Apr 7, 2021\#\dd india doordarshan live dd india live tv dd india online stream, watch dd india live\#\Watch our Special coverage LIVE on DD India
Punyo Sunya from Arunachal Pradesh and Vineeta Garg from Delhi\#\135 views\#\Apr 7, 2021\#\dd india doordarshan live dd india live tv dd india online stream, watch dd india live\#\Watch our Special coverage LIVE on DD India
Pallavi & Arpan Pandey asked on how they can leave behind the nervousness of scoring well in exams\#\128 views\#\Apr 7, 2021\#\dd india doordarshan live dd india live tv dd india online stream, watch dd india live\#\PM Narendra Modi while interacting with M Pallavi from Andhra Pradesh and Arpan Pandey from Global Indian International School Malaysia suggests students not to fear the exam, rather celebrate it. #PPC2021 #ExamWarriors
World Today\#\86 views\#\Apr 7, 2021\#\dd india doordarshan live dd india live tv dd india online stream, watch dd india live\#\Watch our Special coverage LIVE on DD India
Breakfast News: EAM holds talks with Tajikistan Foreign Minister & other top stories | 1/04/2021 |\#\46 views\#\Apr 7, 2021\#\dd india doordarshan live dd india live tv dd india online stream, watch dd india live\#\Breakfast News: EAM holds talks with Tajikistan Foreign Minister & other top stories | 1/04/2021 |
Mid Day Prime | India becomes fastest vaccinating country in the world & more updates | 07.04.2021\#\116 views\#\Apr 7, 2021\#\dd india doordarshan live dd india live tv dd india online stream, watch dd india live, India becomes fastest vaccinating country, Real GDP growth rate at 10.5%, Indian hockey team at Argentina\#\Catch your daily dose of the latest news on 'Mid Day Prime' where we bring news from India and around the world.  Top headlines are: - RBI: Real GDP growth rate at 10.5% - US: Covid-19 vaccination by April 9  - Indian hockey team at Argentina
