Panel of Doctors discuss on Psychological issues & COVID-19 | Doctors Speak | 03.05.2021\#\155 views\#\May 3, 2021\#\dd india doordarshan live dd india live tv dd india online stream, watch dd india live\#\Special Broadcast | Doctors Speak - where we bring to you a panel of doctors who answers your queries and bust all the myths and doubts on the COVID19 outbreak.
Mid Day Prime | Indian Railways delivers 1125 MT of liquid oxygen & more updates | 03.05.2021\#\167 views\#\May 3, 2021\#\dd india doordarshan live dd india live tv dd india online stream, watch dd india live, Indian Railways delivers 1125 MT of liquid oxygen, SC concludes hearing EC's plea, 15.71 crore COVID-19 vaccine doses, DMK newly elected legislature to meet tomorrow, PM Modi to hold a virtual summit tomorrow\#\Catch your daily dose of the latest news on 'Mid Day Prime' where we bring news from India and around the world.  Top headlines are: - SC concludes hearing EC's plea - 15.71 crore COVID-19 vaccine doses administered  - Punjab issues fresh COVID guidelines  - DMK newly elected legislature to meet tomorrow - PM Modi to hold a virtual summit tomorrow
Discussion on the COVID-19 treatment in home isolation, preventive measures & more | Doctors Speak\#\124 views\#\May 3, 2021\#\dd india doordarshan live dd india live tv dd india online stream, watch dd india live\#\Special Broadcast | Doctors Speak - where we bring to you a panel of doctors who answers your queries and bust all the myths and doubts on the COVID19 outbreak.
The News | Over 16.71 crore COVID-19 vaccines administered in India & more updates | 03.05.2021\#\154 views\#\May 3, 2021\#\dd india doordarshan live dd india live tv dd india online stream, watch dd india live, Railways delivers 1094 MT of liquid oxygen, Over 16.71 crore COVID-19 vaccines administered, PM Modi to hold virtual submit, COVID-19 recoveries, india oxygen status, election results 2021\#\Watch "The News" to catch on all the latest news updates from India and around the globe.  Top Headlines are:  - Railways delivers 1094 MT of liquid oxygen  - Supreme Court issues direction to Centre and states to contain COVID-19  - Punjab issues fresh COVID guidelines  - Ruiling paries retains power in three states  - DMK newly elected legislature to meet tomorrow
PM Modi reviews augmenting medical oxygen & more updates | Breakfast News | 03.05.2021\#\209 views\#\May 3, 2021\#\dd india doordarshan live dd india live tv dd india online stream, watch dd india live, medical oxygen, Supreme Court, Indian Railways delivers 1094 metric tonnes of liquid oxygen, fresh COVID guidelines, PM Modi to hold virtual submit\#\Watch 'Breakfast News' to get the latest updates in and around the world along with the latest happenings from the world of sports, business, web reviews, health tips, and more.  Top Headlines: - Indian Railways delivers cumulative 1094 metric tonnes of liquid oxygen to various states  - Supreme Court issues direction to Centre and states to contain COVID-19  - Punjab issues fresh COVID guidelines  - Ruiling paries retains power in three states  - DMK newly elected legislature meets tommorow  - PM Modi to hold virtual submit tomorrow
The legend who remains unparalleled - Satyajit Ray\#\225 views\#\May 2, 2021\#\video, sharing, camera phone, video phone, free, upload\#\The master of creativity . A legend who remains unparalleled . The joy of cinema at the centenary celebrations #SatyajitRay100. A creator of excellence who connected audiences globally . A master who inspired generation of film makers both in India & abroad .
News Night : PM Modi reviews usage of gaseous oxygen for medical purposes\#\217 views\#\May 2, 2021\#\dd india doordarshan live dd india live tv dd india online stream, watch dd india live\#\Top Headlines   -PM Modi reviews usage of gaseous oxygen for medical purposes -Cabinet Secretary reviews state of COVID-19 preparedness in Delhi -PM Modi congratulates Mamata Banerjee for her party's win in West Bengal elections -PM thanks people of Karnataka, Maharashtra, Gujarat, Rajasthan, Uttarakhand for blessing BJP in by-polls -Germany sends a gift of 120 ventilators to India
JANADESH 2021: Counting of votes in Tamil Nadu, Kerala, West Bengal, Assam and Puducherry\#\77 views\#\May 2, 2021\#\dd india doordarshan live dd india live tv dd india online stream, watch dd india live\#\JANADESH 2021: Continuous and accurate coverage of election in four states and one union territory  -Election Commission of India writes to Chief Secretaries of all States/UTs to "prohibit victory celebrations urgently".   -PM reviews progress of converting Nitrogen plants to Oxygen Plants  -PM reviews usage of Gaseous Oxygen for Medical Purposes
JANADESH 2021: Continuous and accurate coverage of election in four states and one union territory\#\145 views\#\May 2, 2021\#\dd india doordarshan live dd india live tv dd india online stream, watch dd india live, Election in 4 states, West Bengal election, Tamil Nadu election, Kerala election, Puducherry election, Assam election\#\Janadesh 2021: Our special assembly election coverage of West Bengal, Assam, Kerala, Tamil Nadu, and Puducherry.
JANADESH 2021: Counting of votes underway in four states and one Union territory\#\66 views\#\May 2, 2021\#\dd india doordarshan live dd india live tv dd india online stream, watch dd india live\#\Janadesh 2021: Our special assembly election voting coverage of West Bengal, Assam, Kerala, Tamil Nadu, and Puducherry.
JANADESH 2021: Assembly election voting updates in 4 states and 1 Union territory\#\141 views\#\May 2, 2021\#\dd india doordarshan live dd india live tv dd india online stream, watch dd india live\#\Janadesh 2021: Our special assembly election voting coverage of West Bengal, Assam, Kerala, Tamil Nadu, and Puducherry.
DD INDIA LIVE 24X7\#\19 watching now\#\Started streaming on May 2, 2021\#\dd india doordarshan live dd india live tv dd india online stream, watch dd india live\#\
News Night:COVID vaccination Phase 3 begins across country and other top news\#\178 views\#\May 1, 2021\#\dd india doordarshan live dd india live tv dd india online stream, watch dd india live\#\News Night:COVID vaccination Phase 3 begins across country and other top news
Aarogya Bharat: Covid-19 Vaccination\#\109 views\#\May 1, 2021\#\dd india doordarshan live dd india live tv dd india online stream, watch dd india live\#\Aarogya Bharat: Covid-19 Vaccination
Doctors Speak: Get answers to all your quries realted to COVID-19 || Diet, Nutrition and COVID-19\#\178 views\#\May 1, 2021\#\dd india doordarshan live dd india live tv dd india online stream, watch dd india live\#\Doctors Speak: Get answers to all your quries realted to COVID-19 || Diet, Nutrition andCOVID-19
15 oxygen concentrators from Thailand arrived in Delhi & more | The News | 01.05.2021\#\159 views\#\May 1, 2021\#\dd india doordarshan live dd india live tv dd india online stream, watch dd india live\#\Top Headlines:  -Third phase of COVID-19 vaccination drive begins today  -Defence Minister Rajnath Singh reviewed the efforts and preparedness of Armed Forces and Ministry of Defence in strengthening India’s fight against the COVID-19   -1st instalment of Rs. 8873.6 crore for State Disaster Response Fund (SDRF) released in advance  -COVID-19: 2,99,988 recoveries registered in last 24 hours  -15 oxygen concentrators from Thailand have arrived in Delhi
Third phase of COVID-19 vaccination begins | Doctors Speak | 01.05.2021\#\149 views\#\May 1, 2021\#\dd india doordarshan live dd india live tv dd india online stream, watch dd india live\#\Special Broadcast | Doctors Speak - where we bring to you a panel of doctors who answers your queries and bust all the myths and doubts on the COVID19 outbreak.
3rd phase of COVID-19 vaccination begins & more | The News | 01.05.2021\#\141 views\#\May 1, 2021\#\dd india doordarshan live dd india live tv dd india online stream, watch dd india live\#\Top Headlines:  -COVID-19: Third phase of vaccination begins today  -1st installment of Rs. 8873.6 crore for State Disaster Response Fund (SDRF) released in advance  -98% of all Air Warriors administered with first dose of COVID-19 vaccine  -Walmart to donate 20 oxygen-generating plants, cryogenic containers to India
More than 90 people found in Houston home in suspected smuggling case & more | The News | 01.05.2021\#\406 views\#\May 1, 2021\#\dd india doordarshan live dd india live tv dd india online stream, watch dd india live\#\Top Headlines:  -PM Modi reviews Covid related situation in a meeting with Empowered Groups  -There is a sufficient stock of liquid oxygen: Ministry of Health  -Government of India to provide Rs 15,000 crore to States for Capital Expenditure  -More than 90 people found in Houston home in suspected smuggling case  -'South African, Brazilian Covid variants found in Pakistan  -Russian vaccine developer plans to sue Brazilian Regulator for defamation  -400th Parkash Purab of Guru Teg Bahadur
News Night: Efforts on in country to meet Oxygen demand & other top news\#\438 views\#\Apr 30, 2021\#\dd india doordarshan live dd india live tv dd india online stream, watch dd india live\#\News Night: Efforts on in country to meet Oxygen demand & other top news
COVID-19: Doctors Speak || How to manage COVID patient at home quarantine\#\170 views\#\Apr 30, 2021\#\dd india doordarshan live dd india live tv dd india online stream, watch dd india live\#\COVID-19: Doctors Speak || How to manage COVID patient at home quarantine
The News: 40 countries come to India's aid and other top news\#\139 views\#\Apr 30, 2021\#\dd india doordarshan live dd india live tv dd india online stream, watch dd india live\#\The News: 40 countries come to India's aid and other top news
The News: PM Modi heads meeting of council of ministers on COVID-19 situation & other top news\#\113 views\#\Apr 30, 2021\#\dd india doordarshan live dd india live tv dd india online stream, watch dd india live\#\The News: PM Modi heads meeting of council of ministers on COVID-19 situation & other top news
Doctors Speak: Know all about Covid-19 vaccination in India\#\127 views\#\Apr 30, 2021\#\dd india doordarshan live dd india live tv dd india online stream, watch dd india live\#\Special Broadcast | Doctors Speak - where we bring to you a panel of doctors who answers your queries and bust all the myths and doubts on the COVID19 outbreak.
Mid Day Prime | India to import 4,50,000 vials of Remdesivir & more updates | 30.04.2021\#\197 views\#\Apr 30, 2021\#\dd india doordarshan live dd india live tv dd india online stream, watch dd india live\#\Catch your daily dose of the latest news on 'Mid Day Prime' where we bring news from India and around the world.  Top headlines are: - CO-WIN registrations cross 2.45 crore  - Global community comes in support of India against COVID-19 - Augmenting Oxygen supply - MHA order to states over containment measures
Discussion on the COVID-19 preventive measures, its implications & more | Doctors Speak | 30.04.2021\#\81 views\#\Apr 30, 2021\#\dd india doordarshan live dd india live tv dd india online stream, watch dd india live, COVID-19, Doctors Speak, COVID-19 testing, COVID-19 vaccination, CO-WIN, Registration for Vaccination\#\Special Broadcast | Doctors Speak - where we bring to you a panel of doctors who answers your queries and bust all the myths and doubts on the COVID19 outbreak.
The News | MHA order to states over containment measures & more updates | 30.04.2021\#\126 views\#\Apr 30, 2021\#\dd india doordarshan live dd india live tv dd india online stream, watch dd india live, MHA order to states over containment, COVID-19, Over 40 countries come to India's aid, Exit poll of WB assembly Predictions: A mixed bag\#\Watch "The News" to catch on all the latest news updates from India and around the globe.  Top Headlines are:  - Augmenting oxygen supply  - COVID-19 Vaccination: Over 15.2 crore doses given  - Over 40 countries come to India's aid  - Exit poll of WB assembly prediction: A mixed bag
Augmenting oxygen supply across the country & more updates | Breakfast News | 30.04.2021\#\172 views\#\Apr 30, 2021\#\dd india doordarshan live dd india live tv dd india online stream, watch dd india live\#\Watch 'Breakfast News' to get the latest updates in and around the world along with the latest happenings from the world of sports, business, web reviews, health tips, and more.  Top Headlines: - COVID-19 Vaccination: Over 15.2 crore doses given  - MHA order to states over containment  - Revised home isolation norms  - PM reviews Army's COVID initiatives  - 40 countries come to India's aid
NEWS NIGHT | 40 countries come to India's aid in fight against Covid19 & other news updates\#\386 views\#\Apr 29, 2021\#\dd india doordarshan live dd india live tv dd india online stream, watch dd india live\#\Watch our daily prime time broadcast on the happenings of the day.
Special Broadcast | Clarify your doubts on Oxygen saturation levels, Home care & Management\#\82 views\#\Apr 29, 2021\#\dd india doordarshan live dd india live tv dd india online stream, watch dd india live\#\Special Broadcast | Clarify your doubts on Oxygen saturation levels, Home care & Management | 29.04.2021
THE NEWS | International community supports India in its fight against COVID19 & other news updates\#\164 views\#\Apr 29, 2021\#\dd india doordarshan live dd india live tv dd india online stream, watch dd india live\#\THE NEWS | International community supports India in its fight against COVID19 & other news updates
Discussion on Diet & Nutrition for COVID patients | Doctors Speak | 29.04.2021\#\156 views\#\Apr 29, 2021\#\dd india doordarshan live dd india live tv dd india online stream, watch dd india live\#\Special Broadcast | Doctors Speak - where we bring to you a panel of doctors who answers your queries and bust all the myths and doubts on the COVID19 outbreak.
Mid Day Prime | Global community comes in support of India against COVID-19 & more | 29.04.2021\#\202 views\#\Apr 29, 2021\#\dd india doordarshan live dd india live tv dd india online stream, watch dd india live, Global community comes in support of India, More than 15 COVID-19 vaccines administered so far in the country, PM reviews Army's initiatives for Covid management, Char Dham yatra suspended\#\Catch your daily dose of the latest news on 'Mid Day Prime' where we bring news from India and around the world.  Top headlines are: - More than 15 COVID-19 vaccines administered so far in the country  - States impose stricter restrictions - PM reviews Army's initiatives for Covid management  - Char Dham yatra suspended  - West Bengal: Voting in phase 8 underway
Discussion on the COVID-19 testing, its implications & more | Doctors Speak | 29.04.2021\#\100 views\#\Apr 29, 2021\#\dd india doordarshan live dd india live tv dd india online stream, watch dd india live, COVID-19, COVID-19 testing, Doctors Speak, myths and doubts on the COVID19 outbreak\#\Special Broadcast | Doctors Speak - where we bring to you a panel of doctors who answers your queries and bust all the myths and doubts on the COVID19 outbreak.
The News | IAF and Indian Railways ramp up transport medical oxygen & more updates | 29.04.2021\#\105 views\#\Apr 29, 2021\#\dd india doordarshan live dd india live tv dd india online stream, watch dd india live, IAF and Indian Railways transport medical oxygen, High response on CO-WIN portal on the first day, COVID-19, Oxygen supply, States roll out strict measures to contain COVID-19, West Bengal Assembly election\#\Watch "The News" to catch on all the latest news updates from India and around the globe.  Top Headlines are:  - High response on CO-WIN portal on the first day of registration of COVID-19 vaccination  - COVID 19: world continues to rally behind India  - States roll out strict measures to contain COVID-19 - 8th & last phase of WB assembly elections - Biden: Wealth must pay their fair share
High response on CO-WIN portal on first day of registration of COVID-19 vaccination & more updates\#\153 views\#\Apr 29, 2021\#\dd india doordarshan live dd india live tv dd india online stream, watch dd india live, CO-WIN portal, PM Modi-Putin discuss COVID, IAF and Railways transport medical oxygen, world continues to rally behind India, 8th & last phase of WB assembly elections\#\Watch 'Breakfast News' to get the latest updates in and around the world along with the latest happenings from the world of sports, business, web reviews, health tips, and more.  Top Headlines: - PM Modi-Putin discuss COVID cooperation  - PM Cares Fund to augment 02 supply - IAF and Railways transport medical oxygen  - COVID: world continues to rally behind India  - 8th & last phase of WB assembly elections
NEWS NIGHT | PM Modi - Russian President Putin discuss Covid cooperation & much more\#\409 views\#\Apr 28, 2021\#\dd india doordarshan live dd india live tv dd india online stream, watch dd india live\#\Watch our daily prime time broadcast on the happenings of the day.
Special Broadcast | Discussion on COVID-19: Focus on Children & Young Adults | 28.04.2021\#\66 views\#\Apr 28, 2021\#\dd india doordarshan live dd india live tv dd india online stream, watch dd india live\#\Special Broadcast | Discussion on COVID-19: Focus on Children & Young Adults | 28.04.2021
THE NEWS | 1 lakh portable oxygen concentrators to be procured from PM CARES fund & other news\#\127 views\#\Apr 28, 2021\#\dd india doordarshan live dd india live tv dd india online stream, watch dd india live\#\THE NEWS | 1 lakh portable oxygen concentrators to be procured from PM CARES fund & other news and updates | 28.04.2021
Discussion on fighting COVID-19 through home care & quarantine | Doctors Speak | 28.04.2021\#\74 views\#\Apr 28, 2021\#\dd india doordarshan live dd india live tv dd india online stream, watch dd india live\#\Special Broadcast | Doctors Speak - where we bring to you a panel of doctors who answers your queries and bust all the myths and doubts on the COVID19 outbreak.
Mid Day Prime | Registration for COVID-19 vaccination opens from today & more updates | 28.04.2021\#\149 views\#\Apr 28, 2021\#\dd india doordarshan live dd india live tv dd india online stream, watch dd india live, Global support for India against COVID-19, DRDO builds 500 02 plants, States impose stricter measures, 6.4 magnitude earthquake shakes Assam\#\Catch your daily dose of the latest news on 'Mid Day Prime' where we bring news from India and around the world.  Top headlines are: - Global support for India against COVID-19 - DRDO to build 500 02 plants using PM cares  - States impose stricter measures  - WB: last phase of elections tomorrow  - 6.4 magnitude earthquake shakes Assam
Discussion on the COVID-19 vaccination, its implications & more | Doctors Speak | 28.04.2021\#\236 views\#\Apr 28, 2021\#\dd india doordarshan live dd india live tv dd india online stream, watch dd india live, COVID-19, COVID-19 vaccination, panel of doctors, queries and bust all the myths and doubts on the COVID19 outbreak\#\Special Broadcast | Doctors Speak - where we bring to you a panel of doctors who answers your queries and bust all the myths and doubts on the COVID19 outbreak.
The News | Air India to airlift 10636 O2 concentrators across the globe this week & more updates\#\107 views\#\Apr 28, 2021\#\dd india doordarshan live dd india live tv dd india online stream, watch dd india live\#\Watch "The News" to catch on all the latest news updates from India and around the globe.  Top Headlines are:  - PM Modi holds high-level COVID review meeting - More than 80 lakh more vaccine will be given to States in the next 3 days - US to send more help to India  - State imposes stricter measures to contain COVID-19 - US ease mask guidelines
PM Modi holds high level COVID review meeting & more updates | Breakfast News | 28.4.2021\#\259 views\#\Apr 28, 2021\#\dd india doordarshan live dd india live tv dd india online stream, watch dd india live, PM Modi holds high level COVID review meeting, COVID19 India\#\Watch 'Breakfast News' to get the latest updates in and around the world along with the latest happenings from the world of sports, business, web reviews, health tips, and more.  Top Headlines: - COVID19 India: 80 lakh more vaccine to States in next 3 days - US to send more help to India  - PM speaks to QATAR Amir  - Air India to airlift 10636 O2 concentrators  - US ease mask guidelines
News Night | PM Modi directs officials to ensure rapid upgradation of health infrastructure and more\#\419 views\#\Apr 27, 2021\#\dd india doordarshan live dd india live tv dd india online stream, watch dd india live\#\Watch our Special coverage LIVE on DD India
Home Quarantine : How to take care of yourself during Covid-19\#\282 views\#\Apr 27, 2021\#\dd india doordarshan live dd india live tv dd india online stream, watch dd india live\#\COVID-19: Things to Keep in Mind During Home Quarantine.  Wash your hands   Wear a facemask if you step out   Wash your hands before you wear your mask.  Protect your immune system by consuming balanced diet
World Today : WHO to send more staff and supplies to India\#\153 views\#\Apr 27, 2021\#\dd india doordarshan live dd india live tv dd india online stream, watch dd india live\#\Top Headlines  -WHO to send more staff and supplies to India  -Armed rebels in Myanmar seize military outpost  -Covid-19: Flight from UK carrying vital medical supplies lands in India  -Covid-19: A flight from the United Kingdom carrying critical medical supplies lands in India.
News: Centre imports 20 cryogenic tankers, new COVID cases down in country & more | 27.04.2021\#\132 views\#\Apr 27, 2021\#\dd india doordarshan live dd india live tv dd india online stream, watch dd india live\#\Top headlines  - EC bans all victory processions - new COVID cases down in the country - Centre imports 20 cryogenic tankers - and more...
Impact of COVID-19 on Mental Health | COVID-19: Doctors Speak | 27.04.2021\#\171 views\#\Apr 27, 2021\#\dd india doordarshan live dd india live tv dd india online stream, watch dd india live\#\Special Broadcast | Doctors Speak - where we bring to you a panel of doctors who answers your queries and bust all the myths and doubts on the COVID19 outbreak.
Ayush Ministry Releases fresh COVID-19 Guidelines & more | Breakfast News | 27.04.2021\#\487 views\#\Apr 27, 2021\#\dd india doordarshan live dd india live tv dd india online stream, watch dd india live\#\Top Headlines:  -Prime Minister Narendra Modi held a telephone conversation with US President Joseph R. Biden. The two leaders discussed the COVID-19 situation in their respective countries, including India’s ongoing efforts to contain the second wave of COVID-19  -Prime Minister Narendra Modi reviews preparations by Armed Forces to assist in Covid management  -Karnataka Government enforces lockdown for 14 days  -Oxygen Express has reached Delhi from Raigarh, Chhattisgarh with Oxygen for patients in the capital: Union Railway Minister Piyush Goyal  -Ayush Ministry Releases fresh COVID-19 Guidelines; Focus on Self-Care and Home Isolation
NEWS NIGHT | PM Modi reviews preparations by Armed Forces to assist in Covid management & much more\#\304 views\#\Apr 26, 2021\#\dd india doordarshan live dd india live tv dd india online stream, watch dd india live\#\Watch our daily prime time broadcast on the happenings of the day.
100 Top News & Updates from India and across the world | EXPRESS NEWS | 26.04.2021\#\201 views\#\Apr 26, 2021\#\dd india doordarshan live dd india live tv dd india online stream, watch dd india live\#\100 Top News & Updates from India and across the world in a quick wrap.
WORLD TODAY | Nomadland sweeps Oscars 2021 & global news and updates | 26.04.2021\#\110 views\#\Apr 26, 2021\#\dd india doordarshan live dd india live tv dd india online stream, watch dd india live\#\WORLD TODAY | Nomadland sweeps Oscars 2021 & global news and updates | 26.04.2021
Press briefing on actions taken, preparedness and updates on COVID-19 | 26.04.2021\#\136 views\#\Apr 26, 2021\#\dd india doordarshan live dd india live tv dd india online stream, watch dd india live\#\COVID-19 India status as on 26.04.2021:  - 28,13,658 active caseload - 1,43,04,382 cumulative recoveries - 1,95,123 fatalities
Mid Day Prime | Oxygen supply across the country boosts up & more updates | 26.04.2021\#\168 views\#\Apr 26, 2021\#\dd india doordarshan live dd india live tv dd india online stream, watch dd india live, Oxygen supply, COVID-19 vaccination, International community extends, West Bengal: 7th phase of polling underway, Man City win the league cup, Oscars, COVID-19\#\Catch your daily dose of the latest news on 'Mid Day Prime' where we bring news from India and around the world.  Top headlines are: - COVID-19 vaccination reaches 14.19 crore  - International community extends help  - West Bengal: 7th phase of polling underway  - Nomadland bags 3 Oscars -  Another round wins best International film at Oscars  - Man City win the league cup
Discussion on boosting oxygen availability to hospitals across the nation | Aatmanirbhar​ Bharat\#\171 views\#\Apr 26, 2021\#\dd india doordarshan live dd india live tv dd india online stream, watch dd india live\#\In our special broadcast 'Aatmanirbhar Bharat', we take a closer look at developments in diverse sectors to better understand and articulate the rise of India.  In today's episode of 'Aatmanirbhar Bharat', we discuss the government's efforts in making oxygen available to every hospital across the nation. The discussion revolves around Oxygen Express, IAF lifting oxygen cylinders, or the Navy supplying oxygen cylinders to even far-off places like island territory.
