Lowest daily new COVID cases in 58 days & more updates | The News | 05.06.2021\#\26 views\#\Jun 5, 2021\#\dd india doordarshan live dd india live tv dd india online stream, watch dd india live\#\Top Headlines:  -Lowest daily new COVID cases in 58 days  -SII gets DCGI approval to manufacture Sputnik V COVID-19 vaccine in India  -Prime Minister Narendra Modi reviews progress of India’s vaccination drive  -Prime Minister Narendra Modi to address World Environment Day event on 5th June
PM Modi participates in the World Environment Day event | 05.06.2021\#\128 views\#\Jun 5, 2021\#\dd india doordarshan live dd india live tv dd india online stream, watch dd india live\#\Prime Minister Narendra Modi participated in the World Environment Day event on 5th June 2021 at 11 AM via video conferencing. The event was being jointly organized by the Ministry of Petroleum & Natural Gas and the Ministry of Environment, Forest and Climate Change.  The theme for this year’s event is ‘promotion of biofuels for a better environment’.
NEWS NIGHT | PM Modi reviews progress of India's vaccination & other news updates\#\282 views\#\Jun 4, 2021\#\dd india doordarshan live dd india live tv dd india online stream, watch dd india live\#\Watch our daily prime time broadcast on the happenings of the day.
VIRTUAL ENCOUNTERS | DD Special interaction with Former Indian Cricketer Anshuman Gaekwad\#\28 views\#\Jun 4, 2021\#\dd india doordarshan live dd india live tv dd india online stream, watch dd india live\#\VIRTUAL ENCOUNTERS | DD Special interaction with Former Indian Cricketer Anshuman Gaekwad | 04.06.2021
THE NEWS | Biden to expand US investment ban on China & other news and updates | 04.06.2021\#\123 views\#\Jun 4, 2021\#\dd india doordarshan live dd india live tv dd india online stream, watch dd india live\#\Catch the Top News stories of the day in our special bulletin ' THE NEWS'.
Press briefing by Health Ministry on current COVID-19 situation in the country\#\69 views\#\Jun 4, 2021\#\dd india doordarshan live dd india live tv dd india online stream, watch dd india live\#\There is a continuous decrease in cases since India reported a peak in cases on 7th May; there are less than 2 lakh daily new cases since 28th May
Panel of top doctors clarify your doubts on COVID-19 | Doctors Speak | 04.06.2021\#\19 views\#\Jun 4, 2021\#\dd india doordarshan live dd india live tv dd india online stream, watch dd india live\#\Watch our special broadcast 'Doctors Speak' where we bring to you a panel of doctors who answer your queries on the #COVID19 outbreak
Defence Minister clears purchase of 6 Diesel-Electric Submarines worth Rs 43,000 Cr & more\#\1,631 views\#\Jun 4, 2021\#\dd india doordarshan live dd india live tv dd india online stream, watch dd india live\#\Defence Ministry clears purchase of 6 Diesel-electric submarines worth  Rs 43,000 crore with air-independent propulsion. Submarines to be built by 2 Indian Shipyards are already shortlisted. Find about more on Mid Day Prime.
Covid-19: Virus variants| COVID-19: Doctors Speak | 04.06.2021\#\44 views\#\Jun 4, 2021\#\dd india doordarshan live dd india live tv dd india online stream, watch dd india live\#\Special Broadcast | Doctors Speak - where we bring to you a panel of doctors who answer your queries and bust all the myths and doubts on the COVID19 outbreak.
WATCH: PM Narendra Modi chairs meeting of CSIR Society | 04.06.2021\#\194 views\#\Jun 4, 2021\#\dd india doordarshan live dd india live tv dd india online stream, watch dd india live\#\In any country, science and technology reach new heights if it has a better relation with the industry, the market. In our country, CSIR works as an institutional arrangement to maintain the same system of Science, Society, and Industry says PM Narendra Modi during his live with CSIR society. He also talks about how India is showing the way to the world in the field of sustainable development and clean energy and more.
US President Joe Biden expands US investment ban on Chinese firms & more updates\#\279 views\#\Jun 4, 2021\#\dd india doordarshan live dd india live tv dd india online stream, watch dd india live\#\Watch 'Breakfast News' to get the latest updates in and around the world along with the latest happenings from the world of sports, business, web review, health tip and more:   Today’s Top Headlines:   1.PM Narendra Modi to chair the meeting of Council of Scientific and Industrial Research Society via video conferencing.  2.PM interacts with the Class 12 students and their parents  3.PM Modi spoke to US Vice President Kamala Harris over the US sending Covid-19 vaccine supplies to India and said he deeply appreciates the initiative.  4.CEA: Economic recovery from next month   5. US President Joe Biden expands US investment ban on Chinese firms  6. French Open 2021: Nadal Vs Norrie
NEWS NIGHT | PM Modi virtually interacts with students & other news updates | 03.06.2021\#\221 views\#\Jun 3, 2021\#\dd india doordarshan live dd india live tv dd india online stream, watch dd india live\#\Watch our daily prime time broadcast on the happenings of the day.
THE NEWS | PM Modi interacts with CBSE students and their parents & other news updates\#\283 views\#\Jun 3, 2021\#\dd india doordarshan live dd india live tv dd india online stream, watch dd india live\#\Catch the Top News stories of the day in our special bulletin ' THE NEWS'.
Panel of top doctors clarify your doubts on COVID-19 | Doctors Speak | 03.06.2021\#\57 views\#\Jun 3, 2021\#\dd india doordarshan live dd india live tv dd india online stream, watch dd india live\#\Watch our special broadcast 'Doctors Speak' where we bring to you a panel of doctors who answers your queries on the #COVID19 outbreak
Army Chief warns Pak against truce breach & more on Mid Day Prime\#\177 views\#\Jun 3, 2021\#\dd india doordarshan live dd india live tv dd india online stream, watch dd india live\#\Catch your daily dose of the latest news on 'Mid Day Prime' where we bring news from India and around the world.  Top headlines are: 1. Army Chief warns Pak against truce breach 2. Israel: Opposition declares new Government  3.Advance arrangements for 30 crore vaccines 4.COVAXIN's clinical trial on children begins  5.Over 22 crore vaccine doses administered 6.The recovery rate climbs to 92.79% 7.State boards cancel class 12 exams 8.Team India ready for England tour
Doctors Speak: Current Status and Protocols to be followed | 03.06.2021\#\91 views\#\Jun 3, 2021\#\dd india doordarshan live dd india live tv dd india online stream, watch dd india live\#\Special Broadcast | Doctors Speak - where we bring to you a panel of doctors who answer your queries about COVID-19. How are we placed in the second wave of the COVID pandemic and more.
NASA announces two new missions to Venus and more | The News | 03.06.2021\#\233 views\#\Jun 3, 2021\#\dd india doordarshan live dd india live tv dd india online stream, watch dd india live\#\Today's Top Headlines:   1.Advance arrangements for 30 crore vaccines 2.COVAXIN's clinical trial on children begins  3.Over 22 crore vaccine doses administered 4.The recovery rate climbs to 92.79% 5.State boards cancel class 12 exams 6. Israel: Opposition declares new Government  7. Team India ready for England tour
Govt. finalises advance arrangement with M/s Biological-E Ltd. for 30 cr COVID vaccine doses & more\#\106 views\#\Jun 3, 2021\#\dd india doordarshan live dd india live tv dd india online stream, watch dd india live\#\Top Headlines:  -Union Ministry of Health finalises advance arrangement with M/s Biological-E Ltd., Hyderabad for 30 cr COVID19 Vaccine doses  -Union Cabinet on Thursday clears Model Tenancy Act  -Central Government's key decision in the battle against COVID-19  paves the way for Pfizer & Moderna vaccines in India.  -Israel: Opposition declares new Government
News Night: Way paved for Pfizer & Moderna vaccines to accelerate nationwide vaccination campaign\#\206 views\#\Jun 3, 2021\#\dd india doordarshan live dd india live tv dd india online stream, watch dd india live\#\News Night: Way paved for Pfizer & Moderna vaccines to accelerate nationwide vaccination campaign  & other top news
The News:DCGI eases norms for foreign-made COVID-19 vaccines & other top news\#\76 views\#\Jun 2, 2021\#\dd india doordarshan live dd india live tv dd india online stream, watch dd india live\#\The News:DCGI eases norms for foreign-made COVID-19 vaccines & other top news
Mucormycosis: Symptoms, Causes & more | COVID-19: Doctors Speak | 02.06.2021\#\36 views\#\Jun 2, 2021\#\dd india doordarshan live dd india live tv dd india online stream, watch dd india live\#\Special Broadcast | Doctors Speak - where we bring to you a panel of doctors who answer your queries and bust all the myths and doubts on the COVID19 outbreak.
Doctors Speak: Get answer to all your queries related to COVID-19 by a panel of top doctors\#\37 views\#\Jun 2, 2021\#\dd india doordarshan live dd india live tv dd india online stream, watch dd india live\#\Doctors Speak: Get answer to all your queries related to COVID-19 pandemic  by a panel of top doctors
Dominican Court To Hear Choksi's extradition plea today & more | Mid Day Prime | 02.06.2021\#\90 views\#\Jun 2, 2021\#\dd india doordarshan live dd india live tv dd india online stream, watch dd india live\#\Top Headlines:  1. Dominican Court To Hear Choksi's plea   2. Unlock cases begin in some states as cases decline; Rajasthan and Bihar relax restrictions for business activities.  3. Cabinet chaired by PM Narendra Modi, approves the Tenancy act.   4. BRICS: Need Reform of Multilateral System   5. Support for Osaka Rallies up
WHO approves China's Sinovac Covid vaccine for emergency use & more | The News | 02.06.2021\#\2,249 views\#\Jun 2, 2021\#\dd india doordarshan live dd india live tv dd india online stream, watch dd india live\#\Top Headlines:  1.CBSE/ICSE 12th Board Exams cancelled. PM expresses that the Health and Safety of students is of utmost importance and there can be no compromise on this.   2. Second- Wave of Covid-19 weakens in India. Unlock process begins in some states.   3. COVID- Guidelines on Children soon. The Centre says it is fully prepared for COVID19 3rd wave which may impact Children.   4. BRICS Foreign Ministers meet virtually held with India as chair; focus remains on  COVID-19, access to vaccine and counter-terrorism.   5. WHO approves China's Sinovac Covid vaccine for emergency use
Brazil signs technology transfer agreement for AstraZeneca vaccine & more | Breakfast News |2.6.2021\#\180 views\#\Jun 2, 2021\#\dd india doordarshan live dd india live tv dd india online stream, watch dd india live\#\Top Headlines:  -CBSE/ICSE 12th Board Exams stand cancelled  -Second wave of COVID-19 weakens in India; the daily positivity rate drops to 6.62%  -Support for Osaka rallies up  -Brazil signs technology transfer agreement for AstraZeneca vaccine
NEWS NIGHT | CBSE Class XII Board Exams cancelled & other news and updates | 01.06.2021\#\356 views\#\Jun 1, 2021\#\dd india doordarshan live dd india live tv dd india online stream, watch dd india live\#\Watch our daily prime time broadcast on the happenings of the day.
Prime Minister Modi chairs review meeting regarding Class XII Board exams of CBSE\#\217 views\#\Jun 1, 2021\#\dd india doordarshan live dd india live tv dd india online stream, watch dd india live\#\Prime Minister Narendra Modi chaired a review meeting regarding the Class XII Board exams of CBSE. Officials gave a detailed presentation on the wide and extensive consultation held so far and views received from all stakeholders, including State governments.
Panel of top doctors clarify your doubts on COVID-19 | Doctors Speak | 01.06.2021\#\95 views\#\Jun 1, 2021\#\dd india doordarshan live dd india live tv dd india online stream, watch dd india live\#\Watch our special broadcast 'Doctors Speak' where we bring to you a panel of doctors who answers your queries on the #COVID19 outbreak
BRICS Foreign Ministers' meet & more updates | Mid Day Prime | 01.06.2021\#\492 views\#\Jun 1, 2021\#\dd india doordarshan live dd india live tv dd india online stream, watch dd india live\#\Catch your daily dose of the latest news on 'Mid Day Prime' where we bring news from India and around the world.  Top headlines are: - Decline in COVID-19 cases in India  -  Gusty winds hit parts of North India  - Indian Boxers shine at the Asian Championship
Discussion on treatment of COVID-19 through home care & quarantine | Doctors Speak | 01.06.2021\#\59 views\#\Jun 1, 2021\#\dd india doordarshan live dd india live tv dd india online stream, watch dd india live, COVID-19, care & quarantine\#\Special Broadcast | Doctors Speak - where we bring to you a panel of doctors who answers your queries and bust all the myths and doubts on the COVID19 outbreak.
Decline in COVID-19 cases in India & more updates | 01.06.2021| The News\#\87 views\#\Jun 1, 2021\#\dd india doordarshan live dd india live tv dd india online stream, watch dd india live\#\Watch "The News" to catch on all the latest news updates from India and around the globe.  Top Headlines are: - BRICS foreign Ministers' meet  - Gusty winds hit parts of North India  - Indian Boxers shine at the Asian Championship
Measures to speed up vaccination & more | Breakfast News | 01.06.2021\#\63 views\#\Jun 1, 2021\#\dd india doordarshan live dd india live tv dd india online stream, watch dd india live\#\Watch 'Breakfast News' to get the latest updates in and around the world along with the latest happenings from the world of sports, business, web reviews, health tips, and more.  Top Headlines: - Partial unlock as COVID cases decline - GDP 1.6% in the fourth quarter  - Gusty winds hit parts of North India
NEWS NIGHT | Delhi High Court dismisses plea to halt Central Vista Project work & other news updates\#\353 views\#\May 31, 2021\#\dd india doordarshan live dd india live tv dd india online stream, watch dd india live\#\Watch our daily prime time broadcast on the happenings of the day.
THE NEWS | World No Tobacco Day observed today & other news and updates | 31.05.2021\#\107 views\#\May 31, 2021\#\dd india doordarshan live dd india live tv dd india online stream, watch dd india live\#\Catch the Top News stories of the day in our special bulletin ' THE NEWS'.
DOCTORS SPEAK | Panel of top doctors clarify your COVID-19 doubts | 31.05.2021\#\44 views\#\May 31, 2021\#\dd india doordarshan live dd india live tv dd india online stream, watch dd india live\#\Special Broadcast | Doctors Speak - where we bring to you a panel of doctors who answers your queries and bust all the myths and doubts on the COVID19 outbreak.
Delhi HC dismisses petition on Central Vista project & more updates | Mid Day Prime | 31.05.2021\#\130 views\#\May 31, 2021\#\dd india doordarshan live dd india live tv dd india online stream, watch dd india live\#\Catch your daily dose of the latest news on 'Mid Day Prime' where we bring news from India and around the world.  Top headlines are: - Many states initiate unlocking process - New cases are lowest in the last 46 days  - Ecowas suspends Mali over coup  - Big upset on the first day at the French open  - India's best show at Asian Boxing Championship
Discussion on COVID-19 symptoms, treatment and vaccination | Doctors Speak | 31.05.2021\#\65 views\#\May 31, 2021\#\dd india doordarshan live dd india live tv dd india online stream, watch dd india live\#\Special Broadcast | Doctors Speak - where we bring to you a panel of doctors who answers your queries and bust all the myths and doubts on the COVID19 outbreak.
India's best show at Asian Boxing Championship & more updates | 31.05.2021| The News\#\478 views\#\May 31, 2021\#\dd india doordarshan live dd india live tv dd india online stream, watch dd india live\#\Watch "The News" to catch on all the latest news updates from India and around the globe.  Top Headlines are: - Many states initiate unlocking process - Ecowas suspends Mali over coup  - Big upset on the first day at the French open  - India's best show at Asian Boxing Championship
Many states initiate unlocking process & more | Breakfast News | 31.05.2021\#\94 views\#\May 31, 2021\#\dd india doordarshan live dd india live tv dd india online stream, watch dd india live, Many states initiate unlocking process, New cases are lowest, Big upset on the first day, India's best show at Asian Boxing Championship\#\Watch 'Breakfast News' to get the latest updates in and around the world along with the latest happenings from the world of sports, business, web reviews, health tips, and more.  Top Headlines: - New cases are lowest in the last 46 days  - Ecowas suspends Mali over coup  - Big upset on the first day at the French open  - India's best show at Asian Boxing Championship
News Night:BJP govt completes 7 years at the Centre under leadership of PM Modi and other top news\#\565 views\#\May 30, 2021\#\dd india doordarshan live dd india live tv dd india online stream, watch dd india live\#\News Night:BJP govt completes 7 years at the Centre under leadership of PM Modi and other top news
DoctorsSpeak : Panel of top doctors clarifies your doubts on 'Covid-19 - Prevention and Treatment'\#\98 views\#\May 30, 2021\#\dd india doordarshan live dd india live tv dd india online stream, watch dd india live\#\#DoctorsSpeak : Panel of top doctors clarifies your doubts on  'Covid-19 - Prevention and Treatment
12 crore COVID-19 vaccine doses for the month of June & more updates | 30.05.2021| The News\#\223 views\#\May 30, 2021\#\dd india doordarshan live dd india live tv dd india online stream, watch dd india live\#\Watch "The News" to catch on all the latest news updates from India and around the globe.  Top Headlines are: - Declining trend of COVID-19 cases  - Chelsea: The champions of Europe
Discussion on COVID-19 vaccinations and myths & more updates | Doctors Speak | 30.05.2021\#\71 views\#\May 30, 2021\#\dd india doordarshan live dd india live tv dd india online stream, watch dd india live, COVID-19, vaccinations and myths, Doctors Speak, panel of doctors\#\Special Broadcast | Doctors Speak - where we bring to you a panel of doctors who answers your queries and bust all the myths and doubts on the COVID19 outbreak.
PM Narendra Modi's 'Mann Ki Baat' with the Nation | May 2021 Edition\#\13,139 views\#\May 30, 2021\#\dd india doordarshan live dd india live tv dd india online stream, watch dd india live\#\Prime Minister Narendra Modi addresses the nation through his Radio Address, Mann Ki Baat. This month's episode sees citizens from various corners of the nation addressing their questions and suggestions to PM Modi.
COVID-19 vaccination exceeds 21 crore mark in the country & more updates | 30.05.2021| The News\#\1,951 views\#\May 30, 2021\#\dd india doordarshan live dd india live tv dd india online stream, watch dd india live\#\Watch "The News" to catch on all the latest news updates from India and around the globe.  Top Headlines are: - PM-Cares for children scheme announced - Delhi extends lockdown restrictions by a week - 77th Mann Ki Baat today
News Night: PM Modi launches ‘PM-Cares for Children’ Scheme & other top news\#\762 views\#\May 30, 2021\#\dd india doordarshan live dd india live tv dd india online stream, watch dd india live\#\News Night: PM Modi launches ‘PM-Cares for Children’ Scheme & other top news
Sports 360°:Liverpool & Chelsea clinch last two Champions League spots and other major sports news\#\580 views\#\May 29, 2021\#\dd india doordarshan live dd india live tv dd india online stream, watch dd india live\#\Sports 360°:Liverpool & Chelsea clinch last two Champions League spots and other major sports news
#DoctorsSpeak|| Discussion on 'COVID-19: Prevention and Management' by a panel of top doctors\#\55 views\#\May 29, 2021\#\dd india doordarshan live dd india live tv dd india online stream, watch dd india live\#\#DoctorsSpeak||  Discussion on 'COVID-19: Prevention and Management' by a panel of top doctors
198 short service commission officers pass out from OTA Chennai & more | 29.05.2021| The News\#\239 views\#\May 29, 2021\#\dd india doordarshan live dd india live tv dd india online stream, watch dd india live\#\Watch "The News" to catch on all the latest news updates from India and around the globe.  Top Headlines are: -  COVID-19: Declining Trend -  Indian boxers shine at ASBC -  Pune: 140th NDA passing out parade - OTA Chennai passing out parade held today
EAM Dr. S. Jaishankar, Anthony Blinken hold bilateral talks & more | 29.05.2021| The News\#\170 views\#\May 29, 2021\#\dd india doordarshan live dd india live tv dd india online stream, watch dd india live\#\Watch "The News" to catch on all the latest news updates from India and around the globe.  Top Headlines are: -  43rd GST council meeting -  India opposes UNGA president's remarks -  Railways continues to deliver LMO - Vaccine coverage exceeds 20.89 crore
Doctors Speak: Post COVID Care | 29.05.2021\#\72 views\#\May 29, 2021\#\dd india doordarshan live dd india live tv dd india online stream, watch dd india live\#\Special Broadcast | Doctors Speak - where we bring to you a panel of doctors who answers your queries and bust all the myths and doubts on the COVID19 outbreak.
140th Passing Out Parade of National Defence Academy | 29.05.2021\#\2,687 views\#\May 29, 2021\#\dd india doordarshan live dd india live tv dd india online stream, watch dd india live\#\140th Passing Out Parade of National Defence Academy | 29.05.2021
NEWS NIGHT | PM Modi undertakes aerial survey of Cyclone Yaas affected states & other top news\#\214 views\#\May 28, 2021\#\dd india doordarshan live dd india live tv dd india online stream, watch dd india live\#\Watch our daily prime time broadcast on the happenings of the day.
Press briefing by Finance Minister Nirmal Sitharaman on the outcomes of 43rd GST Council meeting\#\1,194 views\#\May 28, 2021\#\dd india doordarshan live dd india live tv dd india online stream, watch dd india live\#\Had a detailed engaging meeting today; we were due to meet in early Feb, but due to Union #Budget, Parliament Session, subsequent state elections, we could not meet earlier. Several decisions were taken at 43rd GST Council meeting today.: FM Finance Minister Nirmal Sitharaman
THE NEWS | India welcomes WHO study on COVID origin & other news and updates | 28.05.2021\#\113 views\#\May 28, 2021\#\dd india doordarshan live dd india live tv dd india online stream, watch dd india live\#\Catch the Top News stories of the day in our special bulletin ' THE NEWS'.
DOCTORS SPEAK | Panel of top doctors clarify your COVID-19 doubts | 28.05.2021\#\101 views\#\May 28, 2021\#\dd india doordarshan live dd india live tv dd india online stream, watch dd india live\#\Special Broadcast | Doctors Speak - where we bring to you a panel of doctors who answers your queries and bust all the myths and doubts on the COVID19 outbreak.
India welcome WHO study on COVID origin & more updates | 28.05.2021\#\86 views\#\May 28, 2021\#\dd india doordarshan live dd india live tv dd india online stream, watch dd india live, India welcome WHO, PM Modi visits cyclone-affected Odisha, S Jaishankar meets Jake Sullivan, Assad wins 4th term as President\#\Catch your daily dose of the latest news on 'Mid Day Prime' where we bring news from India and around the world.  Top headlines are: - PM Modi visits cyclone-affected Odisha and West Bengal  - S Jaishankar meets Jake Sullivan - Syria: Assad wins 4th term as President
Discussion on COVID-19 cases and treatments at home| Doctors Speak | 28.05.2021\#\87 views\#\May 28, 2021\#\dd india doordarshan live dd india live tv dd india online stream, watch dd india live\#\Special Broadcast | Doctors Speak - where we bring to you a panel of doctors who answers your queries and bust all the myths and doubts on the COVID19 outbreak.
COVID-19 vaccination exceeds the 20.57 crore mark in the country & more | 27.05.2021| The News\#\42 views\#\May 28, 2021\#\dd india doordarshan live dd india live tv dd india online stream, watch dd india live, COVID-19 vaccination, Financial assistance to journalists, S Jaishankar meets Jake Sullivan, Assad wins 4th term as President, PM Modi visits cyclone-affected Odisha\#\Watch "The News" to catch on all the latest news updates from India and around the globe.  Top Headlines are: - PM Modi visits cyclone-affected Odisha and West Bengal  - Financial assistance to journalists' families  - S Jaishankar meets Jake Sullivan - Syria: Assad wins 4th term as President
PM Modi to visit cyclone-affected Odisha and West Bengal & more | Breakfast News | 28.05.2021\#\216 views\#\May 28, 2021\#\dd india doordarshan live dd india live tv dd india online stream, watch dd india live, PM Modi to visit cyclone-affected, COVID-19 vaccination, S Jaishankar meets Jake Sullivan\#\Watch 'Breakfast News' to get the latest updates in and around the world along with the latest happenings from the world of sports, business, web reviews, health tips, and more.  Top Headlines: - Financial assistance to journalists' families  - COVID-19 vaccination exceeds the 20.54 crore mark  - S Jaishankar meets Jake Sullivan
NEWS NIGHT | India 2nd to achieve 20 crore vaccination landmark & other news and updates\#\159 views\#\May 27, 2021\#\dd india doordarshan live dd india live tv dd india online stream, watch dd india live\#\Watch our daily prime time broadcast on the happenings of the day.
IN FOCUS | COVID-19: Recovery & Road Ahead | Dr. V.K. Paul, Member Health, NITI Aayog\#\121 views\#\May 27, 2021\#\dd india doordarshan live dd india live tv dd india online stream, watch dd india live\#\IN FOCUS | COVID-19: Recovery & Road Ahead | Dr. V.K. Paul, Member Health, NITI Aayog
THE NEWS | India's fight against COVID-19 continues & other news and updates | 27.05.2021\#\96 views\#\May 27, 2021\#\dd india doordarshan live dd india live tv dd india online stream, watch dd india live\#\Catch the Top News stories of the day in our special bulletin ' THE NEWS'.
